Gene_ID	Gene_name	FC_by_DESeq2	FC_by_EdgeR	ratio_of_FC values	p-adj_by_DESeq2	p-adj_by_EdgeR	biological functions
ENSG00000002933.9	TMEM176A	0.00186578175805576	0.00120323296916573	1.550640487643397	7.09023969222032e-13	7.61525229863018e-52	Unknown
ENSG00000004948.16	CALCR	17.1960051231635	13.5668480057744	1.2675018630594546	0.0416863320236967	0.00279175643243403	G protein-coupled receptor signaling pathway, cell surface receptor signaling pathway, signal transduction, adenylate cyclase-modulating G protein-coupled receptor signaling pathway, adenylate cyclase-activating G protein-coupled receptor signaling pathway, positive regulation of gene expression, positive regulation of cytosolic calcium ion concentration, response to amyloid-beta, amylin receptor signaling pathway, positive regulation of protein kinase A signaling, positive regulation of peptidyl-serine phosphorylation, cross-receptor inhibition within G protein-coupled receptor heterodimer, positive regulation of protein kinase B signaling, positive regulation of ERK1 and ERK2 cascade, positive regulation of calcium ion import across plasma membrane, response to glucocorticoid, positive regulation of adenylate cyclase activity, ossification, negative regulation of ossification, osteoclast differentiation
ENSG00000010327.10	STAB1	8.92649918629088	8.76960455279655	1.0178907307108047	2.43043863859233e-07	1.88612139418467e-10	cell adhesion, inflammatory response, defense response to bacterium, negative regulation of angiogenesis, cell-cell signaling
ENSG00000015520.15	NPC1L1	89.9337398789408	86.1939384186252	1.0433882188113066	6.96638825082757e-41	7.96119779416451e-100	lipid metabolic process, steroid metabolic process, cholesterol metabolic process, vitamin transport, cholesterol transport, intestinal cholesterol absorption, cholesterol homeostasis, vitamin E metabolic process, cholesterol biosynthetic process, lipoprotein metabolic process, cellular response to sterol depletion, response to xenobiotic stimulus, response to muscle activity
ENSG00000050767.18	COL23A1	14.562336216868	12.9683653397014	1.1229122434025522	0.00299945823807631	6.14307907985879e-06	Unknown
ENSG00000053438.11	NNAT	0.0718620748663896	0.0722733433875015	0.9943095406710764	9.69952442124635e-17	3.59628613640756e-33	brain development, positive regulation of insulin secretion
ENSG00000054356.14	PTPRN	0.106247468139501	0.105441430859856	1.0076444076400701	1.3366945558182e-235	2.62773234338207e-181	protein dephosphorylation, dephosphorylation, positive regulation of transcription by RNA polymerase II, response to reactive oxygen species, insulin secretion, luteinization, insulin secretion involved in cellular response to glucose stimulus, regulation of secretion, positive regulation of type B pancreatic cell proliferation
ENSG00000055118.17	KCNH2	0.0379129929136436	0.0377751675480486	1.0036485705965352	1.50247822266107e-95	1.08130297098245e-110	ion transport, transmembrane transport, potassium ion transport, ion transmembrane transport, regulation of ion transmembrane transport, potassium ion transmembrane transport, regulation of membrane potential, cardiac muscle contraction, regulation of membrane repolarization, regulation of heart rate by cardiac conduction, positive regulation of potassium ion transmembrane transport, potassium ion import across plasma membrane, regulation of ventricular cardiac muscle cell membrane repolarization, membrane repolarization during cardiac muscle cell action potential, positive regulation of DNA-templated transcription, ventricular cardiac muscle cell action potential, membrane repolarization during action potential, potassium ion export across plasma membrane, membrane repolarization during ventricular cardiac muscle cell action potential, regulation of potassium ion transmembrane transport, potassium ion homeostasis, cellular response to xenobiotic stimulus, negative regulation of potassium ion transmembrane transport, regulation of heart rate by hormone, membrane depolarization during action potential, membrane repolarization
ENSG00000069122.19	ADGRF5	21.2483514911668	20.3737489303301	1.0429279149275612	2.4834418812815e-11	2.61698650959067e-24	G protein-coupled receptor signaling pathway, cell surface receptor signaling pathway, signal transduction, fat cell differentiation, adenylate cyclase-activating G protein-coupled receptor signaling pathway, regulation of lipid metabolic process, energy reserve metabolic process, glomerular filtration, phospholipid biosynthetic process, macrophage activation, glucose homeostasis, negative regulation of macrophage activation, surfactant homeostasis, erythrocyte development, pharyngeal arch artery morphogenesis
ENSG00000070886.12	EPHA8	17.1418672550144	13.4768748637572	1.2719467553351937	0.0436242686515715	0.00585325045905926	protein phosphorylation, transmembrane receptor protein tyrosine kinase signaling pathway, phosphorylation, cell adhesion, nervous system development, regulation of cell adhesion, protein autophosphorylation, positive regulation of MAPK cascade, axon guidance, neuron projection development, regulation of cell adhesion mediated by integrin, ephrin receptor signaling pathway, positive regulation of phosphatidylinositol 3-kinase activity, neuron remodeling, substrate-dependent cell migration
ENSG00000072657.10	TRHDE	0.0409231469885575	0.0407262787164019	1.004833937161961	4.47057880277826e-162	8.82109005991074e-144	proteolysis, signal transduction, cell-cell signaling
ENSG00000073282.14	TP63	8.51937999761301	8.23210470317821	1.0348969437091695	6.07127130733859e-05	3.52539114051721e-09	regulation of DNA-templated transcription, apoptotic process, protein tetramerization, positive regulation of DNA-templated transcription, Notch signaling pathway, negative regulation of transcription by RNA polymerase II, skeletal system development, establishment of planar polarity, morphogenesis of a polarized epithelium, hair follicle development, epithelial cell development, chromatin remodeling, transcription by RNA polymerase II, spermatogenesis, pattern specification process, ectoderm and mesoderm interaction, positive regulation of cell population proliferation, determination of adult lifespan, epidermis development, animal organ morphogenesis, epidermal cell differentiation, proximal/distal pattern formation, epidermal cell division, regulation of epidermal cell division, positive regulation of keratinocyte proliferation, keratinocyte differentiation, embryonic limb morphogenesis, prostate gland development, epithelial cell differentiation, polarized epithelial cell differentiation, hair follicle morphogenesis, negative regulation of intracellular estrogen receptor signaling pathway, embryonic forelimb morphogenesis, embryonic hindlimb morphogenesis, post-anal tail morphogenesis, odontogenesis of dentin-containing tooth, intrinsic apoptotic signaling pathway in response to DNA damage by p53 class mediator, regulation of cysteine-type endopeptidase activity involved in apoptotic process, skin morphogenesis, keratinocyte proliferation, negative regulation of keratinocyte differentiation, positive regulation of Notch signaling pathway, positive regulation of transcription by RNA polymerase II, sympathetic nervous system development, anatomical structure formation involved in morphogenesis, female genitalia morphogenesis, stem cell differentiation, neuron apoptotic process, cloacal septation, prostatic bud formation, squamous basal epithelial stem cell differentiation involved in prostate gland acinus development, establishment of skin barrier, stem cell proliferation, cellular senescence, skin epidermis development, positive regulation of somatic stem cell population maintenance, cranial skeletal system development, negative regulation of mesoderm development, positive regulation of stem cell proliferation, positive regulation of apoptotic signaling pathway, regulation of transcription by RNA polymerase II, negative regulation of DNA-templated transcription, positive regulation of osteoblast differentiation, positive regulation of fibroblast apoptotic process, cellular response to DNA damage stimulus, negative regulation of cellular senescence, positive regulation of cell cycle G1/S phase transition
ENSG00000073756.13	PTGS2	15.527268578764	15.2228718271409	1.0199960135695547	4.10980299751138e-17	5.49574279047485e-26	response to oxidative stress, lipid metabolic process, fatty acid metabolic process, fatty acid biosynthetic process, cellular oxidant detoxification, prostaglandin biosynthetic process, organic substance metabolic process, regulation of blood pressure, prostaglandin metabolic process, positive regulation of cell migration involved in sprouting angiogenesis, regulation of inflammatory response, cellular response to hypoxia, positive regulation of nitric oxide biosynthetic process, positive regulation of vascular endothelial growth factor production, positive regulation of brown fat cell differentiation, positive regulation of fever generation, positive regulation of transforming growth factor beta production, cyclooxygenase pathway, angiogenesis, embryo implantation, learning, memory, positive regulation of cell population proliferation, negative regulation of cell population proliferation, response to xenobiotic stimulus, response to nematode, response to fructose, response to organic substance, response to manganese ion, response to organonitrogen compound, response to organic cyclic compound, bone mineralization, positive regulation of prostaglandin biosynthetic process, positive regulation of synaptic plasticity, negative regulation of synaptic transmission, dopaminergic, prostaglandin secretion, response to estradiol, response to lipopolysaccharide, positive regulation of peptidyl-serine phosphorylation, response to vitamin D, response to cytokine, cellular response to heat, response to tumor necrosis factor, maintenance of blood-brain barrier, regulation of cell population proliferation, positive regulation of protein import into nucleus, hair cycle, positive regulation of apoptotic process, negative regulation of apoptotic process, negative regulation of cysteine-type endopeptidase activity involved in apoptotic process, negative regulation of cell cycle, positive regulation of vasoconstriction, negative regulation of smooth muscle contraction, positive regulation of smooth muscle contraction, decidualization, positive regulation of smooth muscle cell proliferation, brown fat cell differentiation, response to glucocorticoid, negative regulation of calcium ion transport, positive regulation of synaptic transmission, glutamatergic, response to fatty acid, cellular response to mechanical stimulus, cellular response to lead ion, cellular response to ATP, cellular response to organonitrogen compound, cellular response to non-ionic osmotic stress, cellular response to fluid shear stress, positive regulation of fibroblast growth factor production, positive regulation of platelet-derived growth factor production, regulation of neuroinflammatory response, negative regulation of intrinsic apoptotic signaling pathway in response to osmotic stress
ENSG00000073861.3	TBX21	0.0353068962045978	0.0360198324636405	0.9802071189597464	4.24101620890378e-22	3.85686779207437e-50	regulation of DNA-templated transcription, positive regulation of DNA-templated transcription, positive regulation of transcription by RNA polymerase II, proteasome-mediated ubiquitin-dependent protein catabolic process, regulation of transcription by RNA polymerase II, negative regulation of transcription by RNA polymerase II, response to virus, negative regulation of DNA-templated transcription, cell fate specification, regulation of T cell differentiation, negative regulation of T-helper 2 cell cytokine production, positive regulation of T-helper 1 cell cytokine production, negative regulation of interleukin-2 production, T-helper 1 cell lineage commitment, lymphocyte migration, negative regulation of T-helper 17 cell lineage commitment, negative regulation of T-helper 17 cell differentiation, positive regulation of gene expression, T cell differentiation, positive regulation of isotype switching to IgG isotypes, regulation of immune response
ENSG00000074317.11	SNCB	0.0841461658107694	0.0860087129439168	0.978344669169019	2.6342815661771e-08	1.21025150213138e-16	chemical synaptic transmission, synaptic vesicle endocytosis, synapse organization, regulation of neuron death, dopamine metabolic process, negative regulation of neuron apoptotic process
ENSG00000077274.9	CAPN6	14.6815869644707	13.7535123514263	1.0674790983808695	9.57727486613475e-05	9.76494327516382e-10	proteolysis, microtubule bundle formation
ENSG00000077420.16	APBB1IP	0.0181373065186438	0.011512476213252	1.5754479038806581	0.000722610164341859	2.934321374671e-06	signal transduction, T cell activation via T cell receptor contact with antigen bound to MHC molecule on antigen presenting cell
ENSG00000077616.11	NAALAD2	0.114132303064566	0.122927612635545	0.9284513106338828	0.0133858078947919	4.67532034878382e-05	metabolic process
ENSG00000079257.8	LXN	0.00764923087770602	0.00491830533038201	1.555257423823237	6.69655760125364e-07	2.28480740924193e-16	inflammatory response, negative regulation of peptidase activity
ENSG00000082397.18	EPB41L3	0.00408721974553379	0.00426341606508668	0.9586725018475747	7.77934941419878e-44	2.01564981722618e-184	cortical actin cytoskeleton organization, apoptotic process, biological_process, actomyosin structure organization, regulation of cell shape, protein localization to plasma membrane, neuron projection morphogenesis, myelin maintenance, protein localization to paranode region of axon, paranodal junction assembly, protein localization to juxtaparanode region of axon
ENSG00000086570.13	FAT2	0.11344261160962	0.114454660030343	0.9911576477492948	2.73637780289118e-09	5.84723253828096e-19	homophilic cell adhesion via plasma membrane adhesion molecules, cell adhesion, cell-cell adhesion, cell-substrate adhesion
ENSG00000088726.16	TMEM40	0.10132213342625	0.104855549899817	0.9663020557620177	0.000277478861088574	2.98950304616327e-08	Unknown
ENSG00000088827.13	SIGLEC1	11.2705098805068	10.5401717084058	1.069290917862235	0.000739198679593961	1.21234796556187e-07	cell adhesion, inflammatory response, endocytosis, cell-matrix adhesion, cell-cell adhesion
ENSG00000088882.8	CPXM1	0.0873788832503183	0.0874553581709285	0.9991255547720617	8.87132962775697e-25	6.07318073990552e-44	proteolysis, protein processing
ENSG00000089225.20	TBX5	0.00614593788862898	0.00394253365595981	1.5588802594844944	1.47226213128444e-07	1.35349733166579e-15	regulation of DNA-templated transcription, positive regulation of DNA-templated transcription, positive regulation of transcription by RNA polymerase II, heart development, regulation of transcription by RNA polymerase II, negative regulation of cell population proliferation, ventricular septum development, cell-cell signaling, forelimb morphogenesis, cell fate specification, embryonic forelimb morphogenesis, negative regulation of cell migration, sinoatrial node development, regulation of atrial cardiac muscle cell membrane depolarization, pattern specification process, cardiac left ventricle formation, positive regulation of gap junction assembly, pericardium development, embryonic limb morphogenesis, bundle of His cell to Purkinje myocyte communication by electrical coupling, atrioventricular node cell development, bundle of His development, positive regulation of cardioblast differentiation, atrioventricular bundle cell differentiation, positive regulation of cell communication by electrical coupling involved in cardiac conduction, negative regulation of cardiac muscle cell proliferation, cell-cell signaling involved in cardiac conduction, positive regulation of cardiac conduction, morphogenesis of an epithelium, atrioventricular valve morphogenesis, endocardial cushion development, ventricular cardiac muscle tissue development, atrial septum development, transcription by RNA polymerase II, negative regulation of epithelial to mesenchymal transition, lung development, cardiac muscle cell differentiation, cardiac muscle cell proliferation, positive regulation of cardiac muscle cell proliferation, atrial septum morphogenesis, atrioventricular node cell fate commitment, cell migration involved in coronary vasculogenesis
ENSG00000090339.9	ICAM1	9.48988223674891	9.40938433143902	1.0085550661418865	1.54230694991466e-207	1.89064314096759e-117	cell adhesion, cell-cell adhesion, viral entry into host cell, T cell antigen processing and presentation, leukocyte cell-cell adhesion, cell adhesion mediated by integrin, cellular response to glucose stimulus, T cell extravasation, regulation of ruffle assembly, cellular response to leukemia inhibitory factor, cellular response to amyloid-beta, establishment of endothelial barrier, positive regulation of ERK1 and ERK2 cascade, negative regulation of extrinsic apoptotic signaling pathway via death domain receptors, negative regulation of endothelial cell apoptotic process, heterophilic cell-cell adhesion via plasma membrane cell adhesion molecules, regulation of leukocyte mediated cytotoxicity, T cell activation via T cell receptor contact with antigen bound to MHC molecule on antigen presenting cell, positive regulation of cellular extravasation, membrane to membrane docking, adhesion of symbiont to host, receptor-mediated virion attachment to host cell
ENSG00000091704.10	CPA1	0.0791170356640361	0.0866575543322216	0.9129848663940228	0.00541066520650309	4.3063980629137e-06	proteolysis, leukotriene metabolic process, response to cadmium ion
ENSG00000092421.17	SEMA6A	0.106368485967346	0.105956867513764	1.0038847737125536	1.46141935976714e-42	3.20254886580939e-66	apoptotic process, cell differentiation, nervous system development, cytoskeleton organization, cell surface receptor signaling pathway, positive regulation of neuron migration, negative regulation of ERK1 and ERK2 cascade, axon guidance, neural crest cell migration, cellular response to vascular endothelial growth factor stimulus, animal organ morphogenesis, negative regulation of angiogenesis, negative regulation of axon extension involved in axon guidance, negative chemotaxis, semaphorin-plexin signaling pathway, negative regulation of vascular endothelial growth factor signaling pathway, negative regulation of sprouting angiogenesis
ENSG00000095752.7	IL11	0.122429075325814	0.121470147381312	1.007894350712293	3.57430168492939e-259	3.17629545703833e-163	signal transduction, positive regulation of cell population proliferation, fat cell differentiation, cell population proliferation, positive regulation of MAPK cascade, positive regulation of transcription by RNA polymerase II, B cell differentiation, megakaryocyte differentiation, positive regulation of peptidyl-serine phosphorylation, positive regulation of peptidyl-tyrosine phosphorylation, negative regulation of hormone secretion
ENSG00000099769.6	IGFALS	11.4223442947067	10.0978311229417	1.1311680850708408	0.0123770878076045	0.000139886240356748	cell adhesion
ENSG00000099812.9	MISP	18.0407956562547	17.6000794356543	1.0250405813344	9.77051127141475e-25	8.13790945869643e-48	cell division, cell cycle, establishment of mitotic spindle orientation, cell migration, mitotic spindle assembly, organelle localization, establishment of centrosome localization
ENSG00000099984.11	GSTT2	49.8152381146776	70.7586247462812	0.7040164827015761	0.00208266906385252	0.000109869656520864	Unknown
ENSG00000099985.4	OSM	16.7283825721466	14.6345904935703	1.143071449761181	0.00121928239055574	5.60167085383987e-07	immune response, oncostatin-M-mediated signaling pathway, positive regulation of cell division, positive regulation of cell population proliferation, regulation of cell communication, regulation of signaling, positive regulation of phosphatidylinositol 3-kinase signaling, positive regulation of peptidyl-tyrosine phosphorylation, positive regulation of protein kinase B signaling, positive regulation of inflammatory response, negative regulation of cell population proliferation, positive regulation of transcription by RNA polymerase II, positive regulation of peptidyl-serine phosphorylation, positive regulation of MAPK cascade, positive regulation of acute inflammatory response, negative regulation of hormone secretion, positive regulation of interleukin-17 production, positive regulation of tyrosine phosphorylation of STAT protein
ENSG00000100312.11	ACR	31.467679215872	45.3952946242267	0.6931925318770424	0.0166090361329037	0.00117870699552407	proteolysis, single fertilization, acrosome reaction, activation of adenylate cyclase activity, acrosome matrix dispersal, binding of sperm to zona pellucida, penetration of zona pellucida, protein catabolic process
ENSG00000100368.15	CSF2RB	38.128752745826	31.6561234727639	1.2044668949636548	6.20044924239774e-05	3.41917301996525e-11	cytokine-mediated signaling pathway, signal transduction, protein phosphorylation, respiratory gaseous exchange by respiratory system, receptor signaling pathway via JAK-STAT, interleukin-5-mediated signaling pathway, interleukin-3-mediated signaling pathway, granulocyte-macrophage colony-stimulating factor signaling pathway, positive regulation of leukocyte proliferation, immunoglobulin mediated immune response, cellular response to interleukin-3
ENSG00000101188.5	NTSR1	0.0779957915007976	0.0826332070594772	0.9438795161932696	0.00020320581731293	7.46040835189531e-10	G protein-coupled receptor signaling pathway, negative regulation of apoptotic process, signal transduction, neuropeptide signaling pathway, positive regulation of NF-kappaB transcription factor activity, positive regulation of gene expression, chemical synaptic transmission, temperature homeostasis, negative regulation of systemic arterial blood pressure, regulation of membrane depolarization, learning, adult locomotory behavior, positive regulation of glutamate secretion, positive regulation of gamma-aminobutyric acid secretion, response to lipid, positive regulation of apoptotic process, regulation of respiratory gaseous exchange, detection of temperature stimulus involved in sensory perception of pain, negative regulation of release of sequestered calcium ion into cytosol, positive regulation of release of sequestered calcium ion into cytosol, positive regulation of inositol phosphate biosynthetic process, D-aspartate import across plasma membrane, inositol phosphate catabolic process, positive regulation of arachidonic acid secretion, positive regulation of inhibitory postsynaptic potential, L-glutamate import across plasma membrane
ENSG00000101282.9	RSPO4	14.3479119777387	14.0341894238829	1.0223541627079593	3.43903778723919e-20	7.56578126200854e-33	response to stimulus, Wnt signaling pathway, positive regulation of Wnt signaling pathway
ENSG00000101542.10	CDH20	0.114351783117159	0.124652390370995	0.9173653451556046	0.038276173381828	0.0011976622536732	homophilic cell adhesion via plasma membrane adhesion molecules, cell adhesion, cell-cell adhesion, cell-cell junction assembly, cell morphogenesis, calcium-dependent cell-cell adhesion via plasma membrane cell adhesion molecules, adherens junction organization
ENSG00000101938.15	CHRDL1	0.0049879827554931	0.00320357819480221	1.5570035916669922	1.98953592129722e-08	3.99474323178303e-19	cell differentiation, nervous system development, ossification, eye development, negative regulation of BMP signaling pathway, embryonic axis specification, BMP signaling pathway, regulation of synaptic plasticity, synapse maturation, AMPA glutamate receptor clustering
ENSG00000102760.13	RGCC	22.9547723135446	22.7414171706989	1.009381787478073	3.72792992871272e-236	5.68015579475964e-219	regulation of cell cycle, cellular response to hypoxia, positive regulation of gene expression, cell cycle, positive regulation of transcription by RNA polymerase II, positive regulation of DNA-binding transcription factor activity, positive regulation of stress fiber assembly, negative regulation of cell population proliferation, negative regulation of angiogenesis, positive regulation of cytokine production, positive regulation of epithelial to mesenchymal transition, negative regulation of cytokine production, positive regulation of mitotic nuclear division, positive regulation of cyclin-dependent protein serine/threonine kinase activity, positive regulation of G1/S transition of mitotic cell cycle, positive regulation of collagen biosynthetic process, negative regulation of cell-cell adhesion mediated by cadherin, complement activation, negative regulation of endothelial cell proliferation, negative regulation of blood vessel endothelial cell migration, positive regulation of extracellular matrix constituent secretion, positive regulation of endothelial cell apoptotic process, positive regulation of extracellular matrix assembly, negative regulation of exit from mitosis, fibroblast activation, negative regulation of fibroblast growth factor production, negative regulation of mitotic cell cycle phase transition
ENSG00000102854.16	MSLN	9.12922473186091	8.70244382956334	1.0490415003711648	0.000338687598500787	1.52462439246188e-06	cell adhesion
ENSG00000103485.19	QPRT	0.0869406948780196	0.0864778365085996	1.0053523352122018	5.6264196883686e-88	6.18820358720736e-108	NAD biosynthetic process, pyridine nucleotide biosynthetic process, NAD metabolic process
